{
  "id": "lich-su-viet-nam-van-lang-den-1945",
  "title": "Lịch sử Việt Nam từ Văn Lang đến 1945",
  "language": "vi",
  "audience": "Học sinh, sinh viên và người yêu lịch sử",
  "duration_minutes": 25,
  "theme": {
    "preset": "heritage",
    "background": "#0A202B",
    "panel": "#173640",
    "primary": "#F2E8D2",
    "secondary": "#D3B274",
    "accent": "#76B2AE",
    "text": "#E9E2D1",
    "muted": "#ADBBC0",
    "heading_font": "Noto Serif",
    "body_font": "Noto Sans"
  },
  "morph_to_slides": [
    3
  ],
  "requested_slide_count": 15,
  "slides": [
    {
      "type": "cover",
      "title": "TỪ VĂN LANG\nĐẾN NĂM 1945",
      "eyebrow": "LỊCH SỬ VIỆT NAM / 15 SLIDE",
      "subtitle": "Hơn hai thiên niên kỷ dựng nước, giữ nước và đi tìm quyền tự quyết.",
      "notes": "Mở đầu bằng trống đồng Ngọc Lũ, hiện vật tiêu biểu của văn hóa Đông Sơn. Bài trình bày lần theo các bước hình thành nhà nước, phát triển quốc gia tự chủ, những biến động thời cận đại và việc tuyên bố độc lập ngày 2/9/1945. Với giai đoạn Văn Lang, cần phân biệt niên đại theo truyền thuyết và những chứng cứ khảo cổ học; không xem mọi chi tiết trong huyền sử là sự kiện đã được xác quyết.",
      "source_urls": [
        "https://dsvh.gov.vn/trong-dong-ngoc-lu-3014",
        "https://afe.easia.columbia.edu/timelines/vietnam_timeline.htm"
      ],
      "image": "trong_dong"
    },
    {
      "type": "cards",
      "title": "Ba chặng lớn của lịch sử Việt Nam",
      "eyebrow": "NHÌN TOÀN CẢNH",
      "subtitle": "Từ cộng đồng sơ khai đến nhà nước tự chủ, rồi chuyển mình trong thế giới hiện đại.",
      "notes": "Dẫn người nghe qua ba giai đoạn khái quát. Thứ nhất: văn hóa Đông Sơn, Văn Lang, Âu Lạc và cuộc đấu tranh giành quyền tự chủ qua thời Bắc thuộc. Nhấn mốc 938/939 là bước ngoặt. Sau đó: xuất hiện quá trình xây dựng Đại Việt và các triều đại quân chủ, bao gồm cả phân tranh và thống nhất. Cuối cùng: xuất hiện triều Nguyễn, cuộc xâm lược của Pháp và các phong trào giành độc lập. Bức ảnh Ba Đình gắn trực tiếp với sự kiện 2/9/1945.",
      "source_urls": [
        "https://afe.easia.columbia.edu/timelines/vietnam_timeline.htm"
      ],
      "cards": [
        {
          "badge": "TRƯỚC NĂM 939",
          "title": "DỰNG NƯỚC",
          "text": "Văn Lang, Âu Lạc, Đông Sơn và các cuộc khởi nghĩa thời Bắc thuộc.",
          "image": "trong_dong",
          "morph_id": "trong_dong_ngoc_lu",
          "reveal": "static"
        },
        {
          "badge": "939–1802",
          "title": "QUỐC GIA TỰ CHỦ",
          "text": "Các triều đại, văn hóa Đại Việt, chiến tranh bảo vệ và phân tranh.",
          "image": "trinh_nguyen",
          "reveal": "click"
        },
        {
          "badge": "1802–1945",
          "title": "THỬ THÁCH CẬN ĐẠI",
          "text": "Nhà Nguyễn, chế độ thuộc địa và tiến trình giành độc lập.",
          "image": "ba_dinh_1945",
          "reveal": "click"
        }
      ]
    },
    {
      "type": "split",
      "title": "Văn Lang – Âu Lạc: buổi đầu nhà nước",
      "eyebrow": "KHỞI NGUỒN",
      "subtitle": "Huyền sử và dấu tích vật chất cùng góp phần giải thích buổi đầu lịch sử.",
      "notes": "Trống đồng Ngọc Lũ là chứng cứ khảo cổ của văn hóa Đông Sơn, phản ánh trình độ kỹ thuật đúc đồng và đời sống nghi lễ. Văn Lang gắn với truyền thuyết các vua Hùng; mốc lập nước và mô hình tổ chức còn là chủ đề được giới nghiên cứu xem xét, nên không gán niên đại chính xác như một kết luận tuyệt đối. Âu Lạc gắn với An Dương Vương và Cổ Loa vào khoảng thế kỷ III trước Công nguyên. Click 1 chuyển từ Văn Lang sang Âu Lạc; Click 2 phân biệt di sản vật chất với truyền thuyết.",
      "source_urls": [
        "https://dsvh.gov.vn/trong-dong-ngoc-lu-3014",
        "https://afe.easia.columbia.edu/timelines/vietnam_timeline.htm"
      ],
      "image": "trong_dong",
      "image_side": "left",
      "morph_id": "trong_dong_ngoc_lu",
      "bullets": [
        {
          "title": "VĂN LANG",
          "text": "Nhà nước đầu tiên trong truyền thống lịch sử về thời các vua Hùng.",
          "reveal": "auto"
        },
        {
          "title": "ÂU LẠC",
          "text": "Gắn với An Dương Vương và thành Cổ Loa, khoảng thế kỷ III TCN.",
          "reveal": "click"
        },
        {
          "title": "VĂN HÓA ĐÔNG SƠN",
          "text": "Trống đồng là dấu tích vật chất của đời sống và kỹ thuật đương thời.",
          "reveal": "click"
        }
      ]
    },
    {
      "type": "split",
      "title": "Bắc thuộc: đồng hóa và sức kháng cự",
      "eyebrow": "THỬ THÁCH ĐẦU TIÊN",
      "subtitle": "Nhiều thế kỷ lệ thuộc nhưng ý thức tự chủ không biến mất.",
      "notes": "Năm 111 trước Công nguyên, nhà Hán thôn tính Nam Việt và thiết lập hệ thống cai trị ở các vùng thuộc miền bắc Việt Nam ngày nay. Chính quyền phương Bắc tác động đến hành chính và văn hóa, nhưng đời sống bản địa không mất đi. Năm 40, Hai Bà Trưng khởi nghĩa, giành quyền kiểm soát một thời gian ngắn trước khi quân Hán đàn áp năm 43. Năm 544, Lý Bí dựng nước Vạn Xuân. Tranh Đông Hồ là hình tượng dân gian được sáng tác về sau, không phải ảnh ghi lại sự kiện. Click khi chuyển sang từng cuộc nổi dậy.",
      "source_urls": [
        "https://afe.easia.columbia.edu/timelines/vietnam_timeline.htm"
      ],
      "image": "hai_ba_trung",
      "image_side": "right",
      "bullets": [
        {
          "title": "111 TCN",
          "text": "Nhà Hán mở rộng cai trị xuống vùng đất Việt cổ.",
          "reveal": "auto"
        },
        {
          "title": "NĂM 40",
          "text": "Hai Bà Trưng phất cờ khởi nghĩa, giành lại quyền làm chủ.",
          "reveal": "click"
        },
        {
          "title": "NĂM 544",
          "text": "Lý Bí thành lập nước Vạn Xuân, khẳng định ý chí tự chủ.",
          "reveal": "click"
        }
      ]
    },
    {
      "type": "split",
      "title": "Bạch Đằng 938: mở kỷ nguyên tự chủ",
      "eyebrow": "BƯỚC NGOẶT",
      "subtitle": "Chiến thắng quân Nam Hán thay đổi cán cân quyền lực tại vùng đất Việt.",
      "notes": "Ngô Quyền dựa vào thủy triều, địa hình sông Bạch Đằng và bãi cọc để đánh bại đoàn thuyền quân Nam Hán năm 938. Chiến thắng đặt dấu chấm hết cho nỗ lực tái chiếm bằng quân sự của Nam Hán và tạo điều kiện cho Ngô Quyền xưng vương năm 939. Cần phân biệt chiến thắng năm 938 với thời điểm thiết lập vương quyền năm 939. Tranh Đông Hồ là một cách tái hiện hậu thế; giữ nguyên toàn cảnh tranh trong khung ảnh.",
      "source_urls": [
        "https://afe.easia.columbia.edu/timelines/vietnam_timeline.htm"
      ],
      "image": "bach_dang_938",
      "image_side": "left",
      "bullets": [
        {
          "title": "ĐỊA HÌNH",
          "text": "Tận dụng thủy triều và cọc ngầm trên sông Bạch Đằng.",
          "reveal": "auto"
        },
        {
          "title": "938",
          "text": "Ngô Quyền đánh bại thủy quân Nam Hán.",
          "reveal": "click"
        },
        {
          "title": "939",
          "text": "Ngô Quyền xưng vương, mở nền tự chủ lâu dài.",
          "reveal": "click"
        }
      ]
    },
    {
      "type": "split",
      "title": "Đại Việt thời Lý – Trần: xây nền quốc gia",
      "eyebrow": "CỦNG CỐ",
      "subtitle": "Đô thành, giáo dục và thể chế tạo nên sức sống của một quốc gia tự chủ.",
      "notes": "Năm 1010, Lý Công Uẩn dời đô từ Hoa Lư ra Đại La và đổi tên thành Thăng Long. Năm 1054, triều Lý sử dụng quốc hiệu Đại Việt. Năm 1070, Văn Miếu được dựng, là dấu mốc quan trọng về học thuật và nhà nước; Quốc Tử Giám thường được ghi nhận thành lập năm 1076. Những thiết chế này phát triển cùng hệ thống hành chính, văn hóa Phật giáo và Nho học. Ảnh Văn Miếu là ảnh di tích thực tế, dùng để nhận diện di sản kiến trúc. Click để giải thích từng trụ cột.",
      "source_urls": [
        "https://thanglong.chinhphu.vn/english/historical-stages-of-thang-long-ha-noi-110136.htm",
        "https://whc.unesco.org/en/list/1328",
        "https://afe.easia.columbia.edu/timelines/vietnam_timeline.htm"
      ],
      "image": "van_mieu",
      "image_side": "right",
      "bullets": [
        {
          "title": "1010",
          "text": "Dời đô ra Thăng Long, mở không gian chính trị mới.",
          "reveal": "auto"
        },
        {
          "title": "1054",
          "text": "Quốc hiệu Đại Việt khẳng định vị thế quốc gia.",
          "reveal": "click"
        },
        {
          "title": "1070–1076",
          "text": "Văn Miếu và Quốc Tử Giám gắn với sự phát triển giáo dục.",
          "reveal": "click"
        }
      ]
    },
    {
      "type": "split",
      "title": "Nhà Trần: ba lần chặn quân Mông – Nguyên",
      "eyebrow": "GIỮ NƯỚC",
      "subtitle": "Sức mạnh quân sự được tạo bởi tổ chức, địa hình và quyết tâm kháng chiến.",
      "notes": "Triều Trần chống ba cuộc xâm lược Mông – Nguyên, thường tính vào các năm 1258, 1285 và 1287–1288. Trần Quốc Tuấn, thường gọi Trần Hưng Đạo, là một trong những người chỉ huy chủ chốt. Đỉnh cao là chiến thắng Bạch Đằng năm 1288, đánh bại đoàn thuyền tiếp vận và lực lượng của quân Nguyên. Nêu chiến thuật rút lui, phản công và huy động nguồn lực, tránh biến mọi chiến thắng thành hành động của một cá nhân. Chân dung sử dụng là họa phẩm hậu thế.",
      "source_urls": [
        "https://afe.easia.columbia.edu/timelines/vietnam_timeline.htm"
      ],
      "image": "tran_hung_dao",
      "image_side": "left",
      "bullets": [
        {
          "title": "1258",
          "text": "Đẩy lùi cuộc tiến công Mông Cổ đầu tiên.",
          "reveal": "auto"
        },
        {
          "title": "1285",
          "text": "Phản công, buộc quân Nguyên rút khỏi Đại Việt.",
          "reveal": "click"
        },
        {
          "title": "1288",
          "text": "Chiến thắng Bạch Đằng củng cố nền độc lập.",
          "reveal": "click"
        }
      ]
    },
    {
      "type": "timeline",
      "title": "Từ thuộc Minh đến khởi nghĩa Lam Sơn",
      "eyebrow": "HỒI SINH QUỐC GIA",